{
  "schema_version": 1,
  "scope": {
    "kind": "sql_result"
  },
  "truncated": false,
  "columns": [
    {
      "name": "synthetic",
      "type": "INTEGER"
    },
    {
      "name": "synthetic",
      "type": "TEXT"
    }
  ],
  "rows": [
    [
      {
        "kind": "integer",
        "value": "9007199254740993"
      },
      {
        "kind": "text",
        "value": ""
      }
    ]
  ]
}
