{
  "schema_version": 1,
  "scope": {
    "kind": "sql_result"
  },
  "truncated": false,
  "columns": [
    {
      "name": "Zeit",
      "type": "TIMESTAMPTZ"
    }
  ],
  "rows": [
    [
      {
        "kind": "timestamp",
        "value": "0001-01-01T00:00:00.000001Z BC"
      }
    ],
    [
      {
        "kind": "timestamp",
        "value": "0001-01-01T00:00:00.000001Z"
      }
    ],
    [
      {
        "kind": "timestamp",
        "value": "1500-01-01T12:34:56.654321Z"
      }
    ],
    [
      {
        "kind": "timestamp",
        "value": "2026-10-23T05:00:00.000000Z"
      }
    ],
    [
      {
        "kind": "timestamp",
        "value": "infinity"
      }
    ],
    [
      {
        "kind": "timestamp",
        "value": "-infinity"
      }
    ]
  ]
}
